原用户名	原内容	原发布时间	转发用户名	转发用户id	转发内容	点赞数	转发时间	转发来源
娱乐小浪花er	:#朱朝阳为严良庆生# “严良”@史彭元的小严良 在微博晒“朱朝阳”@荣梓杉 为他庆生的照片，并发文：“15岁的第一天很棒喜提一整箱牛奶，谢谢啊！”两人同框一起切蛋糕，感情好好～ 	2020-08-17 00:25:11    	我最亲爱的54430	6765656022	我最亲爱的54430:转发微博	赞[0]	2020-08-17 00:29:03	来自OPPO R9s Plus
娱乐小浪花er	:#朱朝阳为严良庆生# “严良”@史彭元的小严良 在微博晒“朱朝阳”@荣梓杉 为他庆生的照片，并发文：“15岁的第一天很棒喜提一整箱牛奶，谢谢啊！”两人同框一起切蛋糕，感情好好～ 	2020-08-17 00:25:11    	胡亓07	6130641469	胡亓07:兄弟情	赞[0]	2020-08-17 00:38:32	来自iPhone客户端
娱乐小浪花er	:#朱朝阳为严良庆生# “严良”@史彭元的小严良 在微博晒“朱朝阳”@荣梓杉 为他庆生的照片，并发文：“15岁的第一天很棒喜提一整箱牛奶，谢谢啊！”两人同框一起切蛋糕，感情好好～ 	2020-08-17 00:25:11    	用户6032531672	6032531672	用户6032531672:转发微博	赞[0]	2020-08-17 00:37:13	来自三星android智能手机
娱乐小浪花er	:#朱朝阳为严良庆生# “严良”@史彭元的小严良 在微博晒“朱朝阳”@荣梓杉 为他庆生的照片，并发文：“15岁的第一天很棒喜提一整箱牛奶，谢谢啊！”两人同框一起切蛋糕，感情好好～ 	2020-08-17 00:25:11    	用户6032386672	6032386672	用户6032386672:转发微博	赞[0]	2020-08-17 00:59:48	来自三星android智能手机
娱乐小浪花er	:#朱朝阳为严良庆生# “严良”@史彭元的小严良 在微博晒“朱朝阳”@荣梓杉 为他庆生的照片，并发文：“15岁的第一天很棒喜提一整箱牛奶，谢谢啊！”两人同框一起切蛋糕，感情好好～ 	2020-08-17 00:25:11    	用户6032475031	6032475031	用户6032475031:转发微博	赞[0]	2020-08-17 00:52:17	来自三星android智能手机
娱乐小浪花er	:#朱朝阳为严良庆生# “严良”@史彭元的小严良 在微博晒“朱朝阳”@荣梓杉 为他庆生的照片，并发文：“15岁的第一天很棒喜提一整箱牛奶，谢谢啊！”两人同框一起切蛋糕，感情好好～ 	2020-08-17 00:25:11    	朴炯h植女朋友22	6034051324	朴炯h植女朋友22:转发微博	赞[0]	2020-08-17 04:50:23	来自三星android智能手机
